{
  "schema": "https://vesserith.xyz/schemas/github-status-snapshot-v1.json",
  "generatedAt": null,
  "source": "checked-in-fallback",
  "status": "unavailable",
  "entries": [
    {
      "projectId": "vesserith",
      "repository": "https://github.com/wadewolfie999/Vesserith",
      "reviewedRevision": "528d3aa288c72737478636b9d72923d520a98541",
      "observedDefaultBranch": null,
      "observedDefaultRevision": null,
      "observedAt": null,
      "state": "unavailable"
    },
    {
      "projectId": "mynyra",
      "repository": "https://github.com/wadewolfie999/Mynyra",
      "reviewedRevision": "3c02009897dd552f1a0592afe15c602baa882aea",
      "observedDefaultBranch": null,
      "observedDefaultRevision": null,
      "observedAt": null,
      "state": "unavailable"
    },
    {
      "projectId": "nyvora",
      "repository": "https://github.com/wadewolfie999/Nyvora",
      "reviewedRevision": "dbb7d087dbf4b56e4ba193c3ca93cc3ae918ef63",
      "observedDefaultBranch": null,
      "observedDefaultRevision": null,
      "observedAt": null,
      "state": "unavailable"
    },
    {
      "projectId": "hova",
      "repository": "https://github.com/wadewolfie999/Hova",
      "reviewedRevision": "8c3a5bc9c94fa2eae8dbae85bab7b4b9b03b7d68",
      "observedDefaultBranch": null,
      "observedDefaultRevision": null,
      "observedAt": null,
      "state": "unavailable"
    }
  ]
}
